url;name;content;product
https://support.mts.ru/kreditnie_karti/kak-posmotret-istoriyu-operatsii-i-zakazat-vipisku-po-kreditnoi-karte/kak-posmotret-istoriyu-operatsii-po-kreditnoi-karte;Как посмотреть историю операций по кредитной карте;В приложении МТС Банка В приложении выберите нужную карту. Под изображением карты нажмите История операций. Вы также можете выбрать условия операций для просмотра: движение средств: пополнение или списание категория: платежи, переводы, наличные, товары и услуги, вознаграждения период валюта По SMS Вы можете посмотреть три последние операции по карте. Для этого отправьте SMS на номер 2121 с номера, который вы указали в договоре. В SMS укажите Выписка и последние 4 цифры карты Пример SMS: Выписка 1234;Кредитные карты
https://support.mts.ru/kreditnie_karti/kak-posmotret-istoriyu-operatsii-i-zakazat-vipisku-po-kreditnoi-karte/kak-poluchit-vipisku-po-schyotu-kreditnoi-karti;Как получить выписку по счёту кредитной карты;1. В приложении МТС Банка выберите нужную карту 2. Под изображением карты в разделе Информация нажмите Справки и выписки 3. Выберите Выписка за произвольный период . Документы придут на email, который вы укажете;Кредитные карты
https://support.mts.ru/kreditnie_karti/uvedomleniya-ob-operatsiyah-po-karte/kak-podklyuchit-ili-otklyuchit-uvedomleniya-ob-operatsiyah-po-karte-;Как подключить или отключить уведомления об операциях по карте ;Включить услугу можно в приложении МТС Банка : Выберите нужную карту. Под изображением карты в разделе Управление нажмите Уведомления от банка Ознакомьтесь со стоимостью услуги и нажмите кнопку переключения Отключить уведомления об операциях по карте можно в этом же разделе.;Кредитные карты
https://support.mts.ru/kreditnie_karti/kak-posmotret-rekviziti-karti-i-zakazat-spravku/kak-uznat-rekviziti-karti;Как узнать реквизиты кредитной карты;Пластиковая карта В приложении МТС Банка выберите нужную карту. На изображении карты нажмите Реквизиты карты . Здесь будет указан полный номер карты, который можно скопировать, а также срок действия и владелец. Также вы можете посмотреть CVC2. Для этого нажмите на изображение глаза. Напоминаем, что эти данные нельзя сообщать третьим лицам. Если вам нужен номер счёта и банковские реквизиты, под изображением карты в разделе Информация нажмите Реквизиты счета. Эти реквизиты можно отправить. Виртуальная карта В приложении МТС Банка выберите нужную карту. На изображении карты нажмите Реквизиты карты . Здесь будет указан полный номер карты, который можно скопировать, а также срок действия и владелец. Также вы можете посмотреть CVC2. Для этого нажмите на изображение глаза. Напоминаем, что эти данные нельзя сообщать третьим лицам.;Кредитные карты
https://support.mts.ru/kreditnie_karti/kak-posmotret-rekviziti-karti-i-zakazat-spravku/kak-poluchit-spravku-o-dohodah-dlya-gossluzhaschego-;Как получить справку о доходах для госслужащего ;В приложении МТС Банка В приложении МТС Банка зайдите в раздел Ещё 2. Выберите Написать в чат 3. Напишите «Справка для госслужащего». Укажите год, за который нужен документ, и отчётную дату В офисе МТС Банка Выберите ближайший офис МТС Банка Для заказа справки вам потребуется паспорт. Справку можно получить в электронном виде по email или на бумаге. В контактном центре Позвоните нам по номеру 8 800 250-05-20 Мы отправим справку на email, который вы ранее указали в банке. Если справка нужна на другой email, закажите её в приложении МТС Банка. Вы также можете изменить email в приложении Сроки подготовки справки по московскому времени: при заказе до 18:00 справка поступит в этот же день после 19:00 после 18:00 —  на следующий день после 19:00;Кредитные карты
https://support.mts.ru/kreditnie_karti/pin-kod/kak-ustanovit-ili-izmenit-pin-kod;Как установить или изменить  PIN-код;в приложении МТС Банка выберите нужную карту. Под изображением карты в разделе Управление нажмите Изменить PIN-код свяжитесь с нами по телефону 8 800 250-05-20 с номера, который вы указали в договоре. Далее следуйте подсказкам системы Если карта пластиковая, для подтверждения PIN-кода вставьте карту в банкомат любого банка и проверьте баланс. После этого станет доступна бесконтактная оплата и оплата через терминал в магазине.;Кредитные карты
https://support.mts.ru/kreditnie_karti/pin-kod/chto-delat-esli-ne-pomnyu-pin-kod-karti;Что делать, если не помню PIN-код карты;Установите новый PIN-код одним из способов: в приложении МТС Банка выберите нужную карту. Под изображением карты в разделе Управление нажмите Изменить PIN-код свяжитесь с нами по телефону 8 800 250-05-20 с номера, который вы указали в договоре. Далее следуйте подсказкам системы Если карта пластиковая, для подтверждения PIN-кода вставьте карту в банкомат любого банка и проверьте баланс. После этого станет доступна бесконтактная оплата и оплата через терминал в магазине.;Кредитные карты
https://support.mts.ru/kreditnie_karti/blokirovka-karti-i-zaschita-ot-moshennikov/chto-delat-esli-kreditnaya-karta-poteryalas-ili-eyo-ukrali;Что делать, если кредитная карта потерялась или её  украли;Заблокируйте карту одним из способов: В приложении МТС Банка 1. Откройте приложение и выберите нужную карту 2. Под изображением карты в разделе Управление нажмите Блокировка карты > Заблокировать По SMS Отправьте SMS на номер 2121 с номера, который вы указали в договоре. В SMS укажите СТОП и последние 4 цифры карты Пример SMS: СТОП 1234 По звонку в контактный центр Позвоните на номер 8 800 250-05-20 c номера, который вы указали в договоре. Далее следуйте подсказкам системы Перевыпустить карту на неименную можно моментально в магазинах МТС и офисах МТС Банка Если вам нужна именная карта, обратитесь в офис МТС Банка с паспортом. Карта будет готова в течение пяти дней. Стоимость перевыпуска указана в тарифе карты;Кредитные карты
https://support.mts.ru/kreditnie_karti/blokirovka-karti-i-zaschita-ot-moshennikov/chto-delat-esli-moshenniki-ukrali-dengi-s-karti;Что делать, если мошенники украли деньги с кредитной карты;1. Заблокируйте карту одним из способов: В приложении МТС Банка 1. Откройте приложение и выберите нужную карту 2. Под изображением карты в разделе Управление нажмите Блокировка карты > Заблокировать По SMS Отправьте SMS на номер 2121 с номера, который вы указали в договоре. В SMS укажите СТОП и последние 4 цифры карты Пример SMS: СТОП 1234 По звонку в контактный центр Позвоните на номер 8 800 250-05-20 c номера, который вы указали в договоре. Далее следуйте подсказкам системы 2. Обратитесь с паспортом в офис МТС Банка или магазин МТС и заполните заявление о несогласии с операцией;Кредитные карты
https://support.mts.ru/kreditnie_karti/blokirovka-karti-i-zaschita-ot-moshennikov/chto-delat-esli-bank-zablokiroval-kreditnuyu-kartu-ili-prilozhenie;Что делать, если банк заблокировал кредитную карту или приложение;Вам перезвонят из службы поддержки в течение часа и уточнят обстоятельства блокировки. Если вы не ответите на звонок, придёт SMS с просьбой перезвонить по контактному номеру в удобное время . Если звонок не поступил или не пришла SMS, свяжитесь с нами 8 800 250-05-20 . Мы поможем разобраться в ситуации.;Кредитные карты
https://support.mts.ru/kreditnie_karti/blokirovka-karti-i-zaschita-ot-moshennikov/kak-zaschitit-dengi-ot-moshennikov;Как защитить деньги от мошенников;Никому не сообщайте: пароли коды для подтверждения операций полный номер карты и CVV/CVC-код — три цифры на обратной стороне карты логин и пароль от личного кабинета банка Сотрудники банка и госорганов никогда не спрашивают эту информацию. Они не просят установить «защищенное» приложение на телефон, не звонят из мессенджеров и не запрашивают демонстрацию экрана. Если вам поступил такой звонок — это мошенники, прервите звонок. Если у вас остались вопросы или вы столкнулись с мошенниками, свяжитесь с нами по телефону 8 800 250-05-20 или в чате в приложении МТС Банка в раздел Ещё.;Кредитные карты
https://support.mts.ru/kreditnie_karti/kak-zakrit-kreditnuyu-kartu/kak-zakrit-kartu;Как закрыть кредитную карту;Если есть долг, погасите его и закройте карту одним из способов: В приложении МТС Банка 1. Откройте приложение и выберите нужную карту 2. Под изображением карты в разделе Управление нажмите Закрыть карту По SMS Отправьте SMS на номер 2121 с номера, который вы указали в договоре. В SMS укажите ЗАКРЫТЬ и последние 4 цифры карты Пример SMS: ЗАКРЫТЬ 1234 По звонку в контактный центр Позвоните на номер 8 800 250-05-20 c номера, который вы указали в договоре. Далее следуйте подсказкам системы Если на кредитной карте сохраняется долг, закрыть её не получится.;Кредитные карты
https://support.mts.ru/mts_cashback/uchastie-v-programme-mts-cashback/mts-premium-i-mts-cashback-obedinilis-chto-izmenitsya-dlya-uchastnikov-programmi;МТС Premium и МТС Cashback объединились. Что изменилось для участников программы;С 16 октября 2023 года сервис МТС Cashback вошёл в подписку МТС Premium. Вместе с этим обновились условия по списанию и начислению кешбэка для клиентов, у которых подписка не подключена Кешбэк для клиентов с подпиской МТС Premium не сгорает можно тратить на всё из списка на сайте МТС Cashback начисляется без ограничений Кешбэк для клиентов без подписки МТС Premium можно тратить только на благотворительность доступен в течение трёх месяцев, а потом сгорает больше не начисляется за покупку билетов на Ticketland Узнать об изменениях подробнее и подключить МТС Premium можно на сайте;МТС Cashback
https://support.mts.ru/mts_cashback/uchastie-v-programme-mts-cashback/kto-i-kak-mozhet-stat-uchastnikom-programmi;Кто и как может стать участником программы;Клиенты МТС и других операторов. Нужно зарегистрироваться в программе: на сайте МТС Cashback в приложениях Мой МТС, МТС Банк, МТС Live через иконку Premium в правом верхнем углу;МТС Cashback
https://support.mts.ru/mts_cashback/uchastie-v-programme-mts-cashback/skolko-stoit-uchastie-v-programme-mts-cashback;Сколько стоит участие в программе МТС Cashback;Бесплатно;МТС Cashback
https://support.mts.ru/mts_cashback/uchastie-v-programme-mts-cashback/s-kakim-tarifom-nelzya-uchastvovat;С каким тарифом нельзя участвовать;тарифы для городских телефонов, Домашний интернет, Домашний телефон, Цифровое телевидение, Волжский MIX ТВ, Волжский MIX, Волжский MIX Интернет тарифы, в названии которых есть: Тест, Спец, Технологический, Автотестирование, Интеграционный, ИБ, КОРП, SS, ВО, ОФС тарифы 1-2-3, 400 за 600, 1000 за 1300, Персонал Х5, Москва-ЦТВ, Smile и их виды;МТС Cashback
https://support.mts.ru/mts_cashback/uchastie-v-programme-mts-cashback/kak-viiti-iz-programmi-i-chto-budet-s-keshbekom;Как выйти из программы и что будет с кешбэком;При выходе из программы накопленный кешбэк сгорит Чтобы выйти из программы на сайте МТС Cashback 1. Зайдите в Профиль 2. В боковом меню нажмите на Настройки 3. Нажмите кнопку Прекратить внизу раздела;МТС Cashback
https://support.mts.ru/mts_cashback/uchastie-v-programme-mts-cashback/mozhno-li-smenit-vladeltsa-nomera-i-sohranit-svoi-keshbek;Можно ли сменить владельца номера и сохранить свой кешбэк;Пока такой возможности нет. Если сменить владельца номера, кешбэк сгорит Рекомендуем сначала потратить накопленный кешбэк, а затем оформить номер на другого человека. Новый владелец сможет зарегистрироваться в программе МТС Cashback со своими данными и копить кешбэк Если вы уже изменили владельца и кешбэк сгорел, свяжитесь с нами по телефону 8 800 250-23-67 в чате на сайте МТС Cashback в чате в приложении МТС Cashback — значок Профиль в правом нижнем углу — Поддержка — Написать в чат;МТС Cashback
https://support.mts.ru/mts_cashback/poluchit-keshbek/chto-takoe-keshbek-v-mts-i-kak-ego-poluchit;Что такое кешбэк в МТС и как его получить;Что такое кешбэк в МТС Это бонусные рубли программы МТС Cashback, которые вы получаете за покупки у партнёров за подключение подписок и сервисов из раздела Экосистема МТС за покупки через МТС Деньги по картам линейки МТС CASHBACK за покупки по картам линейки МТС CASHBACK Кешбэк в МТС не является реальными деньгами Как получить кешбэк за покупку Зайдите в личный кабинет МТС где удобно на сайте или в приложении МТС Cashback для Android или iOS в приложении Мой МТС — главный экран — значок Premium справа вверху в приложении МТС Live — главный экран — значок Premium справа вверху в приложении МТС Банк для Android — главный экран — значок Cashback справа вверху После этого Выберите акцию партнёра, кроме покупок на Ticketland — за них кешбэк начисляется только с подпиской МТС Premium Перейдите на сайт партнёра через кнопку В магазин , Перейти или Активировать Оплатите заказ на сайте партнёра или в офлайн-магазине Дождитесь, пока начислится кешбэк в срок, который указал партнёр;МТС Cashback
https://support.mts.ru/mts_cashback/poluchit-keshbek/kakie-pravila-nachisleniya-keshbeka;Какие правила начисления кешбэка;Размер, сроки и правила зачисления кешбэка можно узнать на сайте МТС Cashback в карточке каждого партнёра Кешбэк может начисляться как процент от покупки или как фиксированная сумма. Пример: Кешбэк в процентах Кешбэк в рублях Начислить кешбэк не сможем если вы вернули товар, изменили состав заказа, адрес доставки или данные пользователя если вы юридическое лицо. Исключение — акции для юридических лиц;МТС Cashback
https://support.mts.ru/mts_cashback/poluchit-keshbek/kak-uznat-o-nachislenii-keshbeka;Как узнать о начислении кешбэка;Мы пришлём SMS или push-уведомление с суммой начисленного кешбэка. Сообщение также отобразится в правом верхнем углу на любом сайте экосистемы МТС, в колокольчике. Пример:;МТС Cashback
https://support.mts.ru/mts_cashback/poluchit-keshbek/kak-ya-uznayu-skolko-keshbeka-nachisleno-na-schyot-nomera-v-vide-skidki-na-uslugi-svyazi;Как я узнаю, сколько кешбэка начислено на баланс;Кешбэк отображается отдельно от денег, сразу под балансом Остаток кешбэка можно проверить по команде *100# или на Главной странице в приложении Мой МТС;МТС Cashback
https://support.mts.ru/mts_cashback/poluchit-keshbek/kak-pravilno-delat-pokupki-v-internet-magazinah-dlya-polucheniya-keshbeka;Как правильно делать покупки в интернет-магазинах для получения кешбэка;Откройте сайт МТС Cashback . Выберите партнёра Внимательно ознакомьтесь с условиями покупок и начисления кешбэка в описании партнёра Если покупка происходит на сайте партнёра, то в браузере не должно быть блокировщика рекламы В настройках не должно быть блокировки cookie. Убедитесь, что у вас нет плагина сторонней компании. Браузер не должен работать в приватном режиме Очистите корзину и разлогиньтесь на сайте или в приложении партнёра ДО начала совершения покупок через сервис МТС Cashback Найдите и оплатите товар в интернет-магазине партнёра. Не меняйте браузер и не начинайте новую сессию После оплаты товара не закрывайте страницу и дождитесь, когда она загрузится полностью. Оплата возможна доступным в интернет-магазине способом Если вы всё сделали верно, то мы начислим кешбэк после подтверждения покупки партнёром. Начислить кешбэк не сможем: если вы вернули товар, изменили состав товаров, адрес доставки или данные пользователя. Если вам нужно изменить заказ, отмените его и оформите заново если вы юридическое лицо. Исключение: акции для юридических лиц;МТС Cashback
https://support.mts.ru/mts_cashback/poluchit-keshbek/osobennosti-nachisleniya-keshbeka-po-kazhdomu-partneru;Особенности начисления кешбэка по каждому партнеру;В сервисе МТС Cashback более 100 партнёров с определёнными особенностями начисления кешбэка. Воспользуйтесь поиском в разделе «Накопить» и найдите информацию по определённому партнёру. Начисление в размере не более 1000 ₽ кешбэка не чаще одного раза за шесть календарных месяцев может быть предоставлено за полезную обратную связь по ошибкам/некорректной работе системы/ качеству оказываемых услуг при обращении в каналы МТС и в рамках исходящего обзвона.;МТС Cashback
