url;name;content;product
https://support.mts.ru/strahovanie/puteshestvie-/kak-vibrat-tip-otdiha;Как выбрать тип отдыха?;Разберем на примерах Активный отдых - это аквапарк, спуск в пещеры с экскурсией и катание на самокате Спорт - это марафон, катание на лошадях, верблюдах, собачьих упряжках и серфинг Экстремальный спорт - это каякинг, сплав и авиационный спорт Полный перечень видов активностей описан в реестре;МТС Все Cтраховки 
https://support.mts.ru/strahovanie/puteshestvie-dlya-premium-klientov-mts-banka/kak-poluchit-vozmeschenie;Как получить возмещение;Для возмещения понесённых расходов необходимо предоставить в страховую компанию заявление и пакет документов. Информация по пакету документов и порядку их подачи размещена по ссылке;МТС Все Cтраховки 
https://support.mts.ru/strahovanie/puteshestvie-dlya-premium-klientov-mts-banka/chto-delat-esli-moya-poezdka-budet-bolshe-60-dnei;Что делать если моя поездка будет больше 60 дней;Если Вы запланировали поездку длительностью более 60 дней, то рекомендуем приобрести отдельный полис страхования на весь срок. Приобрести полис вы можете здесь Если вы решили задержаться в путешествии, то необходимо приобрести дополнительный полис страхования на необходимый срок. Важно, чтобы дополнительный полис был приобретен заблаговременно и без перерыва в периоде страхования.;МТС Все Cтраховки 
https://support.mts.ru/strahovanie/puteshestvie-dlya-premium-klientov-mts-banka/sport-vklyuchyon-v-sertifikat;Спорт включён в сертификат;Спортивные риски включаются в покрытие в зависимости от программы. Если в вашу программу спорт включен, то это отображается в сертификате страхования. Занятие спортом покрываются только на любительском уровне.;МТС Все Cтраховки 
https://support.mts.ru/strahovanie/puteshestvie-dlya-premium-klientov-mts-banka/-na-kakie-sluchai-polis-strahovaniya-puteshestvii-ne-rasprostranyaetsya; На какие случаи полис страхования путешествий не распространяется;С информацией об исключениях из страхового покрытия Вы можете ознакомится в 5 разделе условий страхования;МТС Все Cтраховки 
https://support.mts.ru/strahovanie/puteshestvie-dlya-premium-klientov-mts-banka/chto-delat-pri-nastuplenii-strahovogo-sluchaya-v-puteshestvii;Что делать при наступлении страхового случая в путешествии;Застрахованному лицу необходимо позвонить по телефону +7 (495) 212-21-91 или 8 (800) 333-33-61 до того, как он получит помощь и сообщить: фамилию, имя, отчество дату рождения номер и срок действия страхового сертификата (при наличии) местонахождение и номер телефона для связи что произошло Важно: Строго следуйте указаниям оператора Не оплачивайте счета самостоятельно без согласования с сервисной компанией Если вам не удалось связаться с сервисной компанией до получения медицинской помощи, сделайте это при первой возможности.;МТС Все Cтраховки 
https://support.mts.ru/strahovanie/puteshestvie-dlya-premium-klientov-mts-banka/kak-podat-dokumenti-pri-strahovom-sluchae;Как подать документы при страховом случае;Документы можно подать: в Личном кабинете на сайте страховой компании. Рассмотрение осуществляется на основании предоставленных документов через Личный кабинет. Для получения суммы выплат более 50 000 рублей потребуется предоставление оригиналов. Оригиналы документов можно подать: в офисе страховой компании. В случае возникновения вопросов вы можете обратиться по круглосуточному номеру телефона +7 (495) 788-0-999. направив заказное письмо почтой по адресу: 115162, г. Москва, ул. Шаболовка, 31 Б, АО «АльфаСтрахование», Управление страхование путешествующих, Отдел урегулирования убытков. Срок рассмотрения обращения — 15 рабочих дней. Решение о выплате принимается на основании полного пакета документов. Если вами предоставлен не полный пакет документов, страховая направит вам дополнительный запрос. Выплата осуществляется в течение 7 рабочих дней с момента принятия решения Страховщиком. С информацией о необходимом пакете документов вы можете ознакомиться здесь;МТС Все Cтраховки 
https://support.mts.ru/strahovanie/puteshestvie-dlya-premium-klientov-mts-banka/kakie-dokumenti-neobhodimo-podat-pri-strahovom-sluchae;Какие документы необходимо подать при страховом случае;Список документов при страховом случае;МТС Все Cтраховки 
https://support.mts.ru/strahovanie/puteshestvie-dlya-premium-klientov-mts-banka/ostalsya-vopros;Остался вопрос;Если у вас остались вопросы, вы можете обратиться на единую линию поддержки АльфаСтрахования: +7 495 788 09 99;МТС Все Cтраховки 
https://support.mts.ru/strahovanie/strahovanie-ipoteki/kakie-dokumenti-nuzhni-dlya-pokupki-polisa;Какие документы нужны для покупки полиса?;Паспорт и кредитный договор. Для расчёта стоимости полиса также понадобится сумма остатка долга по ипотеке. Сумму остатка можно узнать в банке, выдавшем ипотеку.;МТС Все Cтраховки 
https://support.mts.ru/strahovanie/strahovanie-ipoteki/gde-mozhno-naiti-chek-posle-pokupki-polisa;Где можно найти чек после покупки полиса?;Чек придет на указанный вами почтовый адрес. Если вы не нашли его во «Входящих», проверьте папку «Спам». Также чек можно найти в личном кабинете .;МТС Все Cтраховки 
https://support.mts.ru/strahovanie/strahovanie-ipoteki/dlya-kakih-bankov-dostupno-predlozhenie;Для каких банков доступно предложение?;Предложение доступно для заёмщиков СберБанка, МТС банка, ВТБ Банка и МКБ.;МТС Все Cтраховки 
https://support.mts.ru/strahovanie/strahovanie-ipoteki/tekuschii-polis-zakonchitsya-tolko-v-sleduyuschem-mesyatse-mogu-li-ya-uzhe-priobresti-novii;Текущий полис закончится только в следующем месяце. Могу ли я уже приобрести новый?;Да. Предложение доступно, даже если ваш текущий полис закончится не скоро. Вы можете выбрать удобную дату начала действия полиса, начиная с завтрашнего дня.;МТС Все Cтраховки 
https://support.mts.ru/strahovanie/strahovanie-ipoteki/kak-uznat-dopuschena-li-strahovaya-kompaniya-k-strahovaniyu-ipotechnih-dogovorov-moego-banka;Как узнать, допущена ли Страховая компания к страхованию ипотечных договоров моего банка?;Перечень страховых компаний, которые соответствуют требованиям банка-кредитора, можно узнать на сайте банка или уточнить по телефону в самом отделении банка.;МТС Все Cтраховки 
https://support.mts.ru/strahovanie/strahovanie-ipoteki/skolko-deistvuet-dogovor-ipotechnogo-strahovaniya;Сколько действует договор ипотечного страхования?;Договор ипотечного страхования заключается на один год либо на весь срок действия кредитного договора с ежегодной пролонгацией. Срок действия полиса определяется требованиями кредитора. Срок оплаченного периода договора страхования ипотеки для клиентов ПАО СберБанк, МТС банка, ВТБ Банка и МКБ составляет 12 месяцев.;МТС Все Cтраховки 
https://support.mts.ru/strahovanie/strahovanie-ipoteki/zachem-strahovat-zdorove-i-zhizn-zaemschika;Зачем страховать здоровье и жизнь заемщика?;Страхование жизни и здоровья заемщика помогает обезопасить обе стороны ипотечного договора от непредвиденных ситуаций. Например, в случае болезни или смерти заемщика оставшуюся задолженность банку выплатит страховая компания. При этом процентная ставка по выплате ипотеки уменьшится, ведь банк получит гарантии, что долг будет погашен.;МТС Все Cтраховки 
https://support.mts.ru/strahovanie/strahovanie-ipoteki/skolko-stoit-strahovanie-kvartiri-pri-ipoteke;Сколько стоит страхование квартиры при ипотеке?;В основном, ставки страховых компаний приблизительно составляют 1% от суммы ипотеки. Узнать точную стоимость можно с помощью нашего калькулятора страхования ипотеки. Рассчитать стоимость;МТС Все Cтраховки 
https://support.mts.ru/strahovanie/strahovanie-ipoteki/kak-rasschitat-stoimost-ipotechnogo-strahovaniya-zhizni;Как рассчитать стоимость ипотечного страхования жизни?;"Чтобы узнать, сколько будет стоить ипотечное страхование жизни и здоровья, воспользуйтесь нашим калькулятором стоимости страхования ипотеки. Оставьте галочку только в разделе ""Жизнь и здоровье"". Рассчитать стоимость";МТС Все Cтраховки 
https://support.mts.ru/strahovanie/strahovanie-ipoteki/chto-delat-esli-proizoshyol-strahovoi-sluchai;Что делать, если произошёл страховой случай?;Как сообщить о страховом случае?;МТС Все Cтраховки 
https://support.mts.ru/strahovanie/ipoteka-sberbanka/gde-naiti-chek-posle-pokupki;Где найти чек после покупки;Чек придет после покупки на указанный вами почтовый адрес. Если вы не нашли документ во «Входящих», проверьте папку «Спам». Также чек можно найти в Личном кабинете нашего сервиса;МТС Все Cтраховки 
https://support.mts.ru/strahovanie/ipoteka-sberbanka/kak-proverit-chto-strahovaya-kompaniya-dopuschena-k-strahovaniyu-ipotechnih-dogovorov-moego-banka;Как проверить, что Страховая компания допущена к страхованию ипотечных договоров моего банка;Перечень страховых компаний, которые соответствуют требованиям банка-кредитора, можно узнать на сайте банка или уточнить по телефону в самом отделении банка;МТС Все Cтраховки 
https://support.mts.ru/strahovanie/ipoteka-sberbanka/u-menya-chastnii-dom-mogu-li-ya-oformit-polis-po-strahovaniyu-imuschestva;У меня частный дом. Могу ли я оформить полис по страхованию имущества;Да, на нашем сайте можно застраховать частный дом;МТС Все Cтраховки 
https://support.mts.ru/strahovanie/ipoteka-sberbanka/tekuschii-polis-zakonchitsya-tolko-v-sleduyuschem-mesyatse-dostupno-li-mne-predlozhenie;Текущий полис закончится только в следующем месяце. Доступно ли мне предложение;Предложение доступно, даже если ваш текущий полис закончится не скоро. Вы можете выбрать любую дату начала действия полиса, начиная с завтрашнего дня;МТС Все Cтраховки 
https://support.mts.ru/strahovanie/ipoteka-sberbanka/dlya-kakogo-banka-dostupno-predlozhenie-ipotechnogo-strahovaniya;Для какого банка доступно предложение ипотечного страхования;Предложение доступно для СберБанка;МТС Все Cтраховки 
https://support.mts.ru/strahovanie/ipoteka-sberbanka/nuzhno-li-otnosit-kuplennii-polis-strahovaniya-v-otdelenie-banka;Нужно ли относить купленный полис страхования в отделение банка;Идти никуда не нужно, вы можете отправить его онлайн если вы купили полис компании Ренессанс Страхование, ВСК или АльфаСтрахование, зайдите на сайт Домклик и загрузите полис и чек об оплате если вы купили полис компании Сбербанк Страхование, ничего делать не нужно, он подгрузится в Домклик автоматически;МТС Все Cтраховки 
https://support.mts.ru/strahovanie/ipoteka-sberbanka/kakoi-srok-deistviya-u-dogovora-ipotechnogo-strahovaniya;Какой срок действия у договора ипотечного страхования?;Договор ипотечного страхования заключается на один год либо на весь срок действия кредитного договора с ежегодной пролонгацией. Срок действия полиса определяется требованиями кредитора. Срок действия договора страхования ипотеки для клиентов СберБанка составляет 12 месяцев;МТС Все Cтраховки 
https://support.mts.ru/strahovanie/ipoteka-sberbanka/povisitsya-li-protsentnaya-stavka-po-ipoteke-esli-prodlit-strahovanie-u-nas-;Повысится ли процентная ставка по ипотеке, если продлить страхование у нас;Вы имеете право выбрать любую страховую компанию, допущенную к страхованию ипотечных договоров СберБанка. Ставка может поменяться только при отсутствии договора страхования имущества, переход в другую страховую компанию не изменит вашей текущей ставки по кредиту;МТС Все Cтраховки 
https://support.mts.ru/strahovanie/ipoteka-sberbanka/chto-delat-pri-nastuplenii-strahovogo-sluchaya-po-ipoteke;Что делать при наступлении страхового случая по ипотеке;Мои действия;МТС Все Cтраховки 
https://support.mts.ru/strahovanie/ipoteka-sberbanka/kak-uznat-summu-ostatka-zadolzhennosti-v-sberbanke;Как узнать сумму остатка задолженности в СберБанке?;"Найдите пункт ""Кредиты"" в приложении СберБанка. Раскройте его и вы увидите сумму остатка долга в рублях.";МТС Все Cтраховки 
https://support.mts.ru/strahovanie/ipoteka-sberbanka/kak-uznat-nomer-ipotechnogo-dogovora-sberbanka-i-datu-ego-zaklyucheniya-;Как узнать номер ипотечного договора СберБанка и дату его заключения;"Шаг 1 . Зайдите в приложение и найдите пункт ""Кредиты"". Выберите ипотечный кредит, который вы хотите застраховать. Шаг 2. Нажмите на пункт ""О кредите"" в правом верхнем углу. Шаг 3. Выберите пункт ""Детальная Информация"". Шаг 4. Здесь вы найдете номер договора и дату его заключения (открытия кредита).";МТС Все Cтраховки 
https://support.mts.ru/strahovanie/ipoteka-vtb-banka/gde-naiti-chek-posle-pokupki-polisa;Где найти чек после покупки полиса;Чек придет после покупки на указанный вами почтовый адрес. Если вы не нашли документ во «Входящих», проверьте папку «Спам». Также чек можно найти в Личном кабинете нашего сервиса;МТС Все Cтраховки 
https://support.mts.ru/strahovanie/ipoteka-vtb-banka/ya-yavlyayus-sobstvennikom-chastnogo-doma-mogu-li-oformit-polis-strahovaniya-imuschestva;Я являюсь собственником частного дома. Могу ли оформить полис страхования имущества;Нет, предложение действует только для квартир в многоэтажных домах, построенных позднее 1950 года и не имеющих деревянных перекрытий. Весь список ограничений есть в условиях страхования.;МТС Все Cтраховки 
https://support.mts.ru/strahovanie/ipoteka-vtb-banka/tekuschii-polis-esche-deistvuet-dostupno-li-mne-predlozhenie;Текущий полис еще действует. Доступно ли мне предложение;Предложение доступно, даже если ваш текущий полис не закончился. Вы можете выбрать дату за 33 дня до начала действия полиса, начиная с завтрашнего дня.;МТС Все Cтраховки 
https://support.mts.ru/strahovanie/ipoteka-vtb-banka/-kak-proverit-chto-renessans-strahovanie-dopuschen-k-strahovaniyu-ipotechnih-dogovorov-vtb-bank; Как проверить, что Ренессанс страхование допущен к страхованию ипотечных договоров ВТБ Банк;Перечень страховых компаний, которые соответствуют требованиям банка-кредитора, можно узнать на сайте банка или уточнить по телефону в самом отделении банка.;МТС Все Cтраховки 
https://support.mts.ru/strahovanie/ipoteka-vtb-banka/dlya-kakogo-banka-dostupno-predlozhenie-strahovaniya;Для какого банка доступно предложение страхования;Предложение действует для заемщиков ВТБ Банка.;МТС Все Cтраховки 
https://support.mts.ru/strahovanie/ipoteka-vtb-banka/nuzhno-li-otnosit-kuplennii-polis-v-otdelenie-vtb-banka;Нужно ли относить купленный полис в отделение ВТБ Банка;Не нужно, информация о приобретении полиса страхования поступит в банк автоматически.;МТС Все Cтраховки 
https://support.mts.ru/strahovanie/ipoteka-vtb-banka/kakoi-srok-deistviya-polisa-ipotechnogo-strahovaniya;Какой срок действия полиса ипотечного страхования;Договор ипотечного страхования заключается на весь срок действия кредитного договора с ежегодной пролонгацией. Срок действия полиса определяется требованиями кредитора. Срок оплаченного периода договора страхования ипотеки для клиентов ВТБ Банка составляет 12 месяцев.;МТС Все Cтраховки 
https://support.mts.ru/strahovanie/ipoteka-vtb-banka/mozhet-li-povisitsya-protsentnaya-stavka-po-ipoteke-esli-prodlit-strahovanie-zhizni-u-nas;Может ли повыситься процентная ставка по ипотеке, если продлить страхование жизни у нас;Вы имеете право выбрать любую страховую компанию, допущенную к страхованию ипотечных договоров ВТБ Банка. Ставка может поменяться только при отсутствии договора страхования имущества, переход в Ренессанс страхование не изменит вашей текущей ставки по кредиту.;МТС Все Cтраховки 
https://support.mts.ru/strahovanie/ipoteka-vtb-banka/chto-delat-esli-nastupil-strahovoi-sluchai;Что делать, если наступил страховой случай;Мои действия;МТС Все Cтраховки 
https://support.mts.ru/strahovanie/ipoteka-vtb-banka/kak-uznat-summu-ostatka-zadolzhennosti-;Как узнать сумму остатка задолженности;Сумму задолженности по ипотеке можно узнать: в личном кабинете приложения ВТБ онлайн в любом отделении банка на горячей линии ВТБ Банка: 8 (800) 100-24-24 Бесплатный звонок по России 8 (495) 777-24-24 Для жителей Москвы и Московской области 1000 Бесплатно для абонентов Tele2, МегаФон, Билайн, МТС, ВТБ Мобайл;МТС Все Cтраховки 
https://support.mts.ru/strahovanie/ipoteka-vtb-banka/kak-uznat-nomer-dogovora-i-datu-ego-zaklyucheniya-;Как узнать номер договора и дату его заключения;Узнать номер договора и дату его заключения можно: в личном кабинете приложения ВТБ онлайн в любом отделении банка;МТС Все Cтраховки 
