url;name;content;product
https://support.mts.ru/invetitsii/s-chego-nachat/s-chego-nachat;С чего начать;Перед тем, как начать инвестировать, вам нужно решить: вы хотите это делать самостоятельно или доверить профессиональным инвесторам. Для самостоятельного инвестирования вам понадобится брокер, для передачи инвестиций под управление — управляющая компания. Управляющая компания берёт на себя всю работу по управлению вашим портфелем . Вы передаете ей денежные средства в доверительное управление, и профессиональный управляющий принимает инвестиционные решения и совершает сделки за вас. Задача управляющего — показать как можно более высокую доходность, так как основной источник прибыли управляющей компании — это вознаграждение за управление активами. При инвестировании через управляющую компанию вы экономите время — не нужно самому изучать работу фондового рынка и отслеживать изменения. Также снижаете риски, так как сделки совершают профессионалы. Брокерское обслуживание позволяет совершать сделки с ценными бумагами и валютой самостоятельно. Вы сами выбираете инструменты, время покупки или продажи, срок инвестирования. Можно торговать каждый день, а можно инвестировать на годы и пересматривать портфель раз в несколько лет — зависит от ваших предпочтений.  Чтобы лучше ориентироваться в рынке и правильно оценивать риски, рекомендуем вам пройти наш курс начинающего инвестора. В приложении МТС Инвестиции вы можете открыть брокерский счет для самостоятельной торговли ценными бумагами, а также инвестировать в продукты доверительного управления – паевые инвестиционные фонды и индивидуальные инвестиционные счета под управлением Управляющей компании Система Капитал .;МТС Инвестиции
https://support.mts.ru/invetitsii/brokerskii-schyot/obschaya-informatsiya;Общая информация;Что такое брокерский счёт и для чего он нужен Брокерский счёт предназначен для сделок с ценными бумагами на бирже. Услугу брокерского обслуживания предоставляет МТС Банк, который выступает посредником между инвестором и биржей, так как торговля напрямую между физическим лицом и биржей невозможна. Как узнать реквизиты брокерского и депозитарного договора Реквизиты ваших договоров и счетов вы можете посмотреть: В уведомлениях об открытии счетов, которые банк направляет на вашу электронную почту В отчётах по операциям, которые банк направляет на вашу электронную почту на следующий рабочий день после любого движения по вашему счёту Какие инвестиционные лицензии есть у банка У МТС Банка есть лицензии профессионального участника рынка ценных бумаг на осуществление брокерской, депозитарной и дилерской деятельности. Где узнать условия оказания брокерских услуг В Регламенте оказания ПАО МТС Банк услуг на рынках ценных бумаг, который размещен на сайте банка. Как получить статус квалифицированного инвестора Нужно выполнить любое из условий владеть имуществом на сумму от 6 млн рублей. Учитываются только деньги на счетах и депозитах в банках, договоры обезличенных металлических счетов и ценные бумаги. Недвижимость или коллекция антиквариата не подойдёт иметь опыт работы в организации, которая совершала сделки с ценными бумагами или производными инструментами. Нужно два года опыта, если организация — квалифицированный инвестор, и три года — в других случаях получить экономическое образование в вузе, который на тот момент мог аттестовывать в сфере профессиональной деятельности на рынке ценных бумаг. Или иметь аттестат специалиста финансового рынка, аудитора, страхового актуария, CFA, CIIA, FRM за последний год совершить сделки с ценными бумагами или деривативами на сумму от 6 млн рублей. При этом каждый месяц должно быть не менее одной сделки, а каждый квартал — в среднем не менее 10 сделок Подробнее можно узнать в Регламенте признания клиентов квалифицированными инвесторами Чтобы подать заявку на получение статуса квалифицированного инвестора, откройте приложение МТС Инвестиции — меню на экране Мои Активы — раздел Квалификация По каким доходам МТС Банк выступает как налоговый агент, и что это значит Банк выступает налоговым агентом по доходам от сделок купли-продажи ценных бумаг. Вам не нужно дополнительно подавать налоговую декларацию. Банк сам фиксирует доход и удерживает налог. Кроме дохода в виде дивидендов по иностранным акциям. В этом случае подавать налоговую декларацию нужно самостоятельно. Какие комиссии мы берём за обслуживание Мы берём комиссию от суммы дневного оборота: 0,3% на тарифе МТС Инвестиции — минимум 5 рублей в день сделки до 0,215% на тарифе Стандартный —  минимум 50 рублей в день сделки Если вы не проводите сделок, мы не берём комиссию. Если вы пополняете счёт в приложении МТС Инвестиции с карты другого банка, то комиссия будет 0,65% от суммы. О том, как пополнять без комиссии, читайте в разделе Пополнение брокерского счёта . Всё остальное бесплатно открытие и закрытие брокерского счёта сделки с валютой по курсу МТС Банка обслуживание счёта депо вывод денег хранение ценных бумаг Как сменить тариф на iOS и Android: приложение МТС Инвестиции — Мои активы — меню в правом верхнем углу — Информация о тарифе Почему мой брокерский счёт заблокирован, а в приложении сообщение «Проблема со счётом» Возможно, у вас сменился паспорт, и не получилось вовремя обновить анкетные данные по брокерскому счёту. По брокерскому счёту у нас отдельная анкета, сотрудники в отделениях банка её обновить не могут. Вам нужно обратиться в поддержку сервиса МТС Инвестиции удобным способом: в приложении МТС Инвестиции в разделе Ещё ― Помощь ― Обратная связь написать на почту mtsi@mtsbank.ru;МТС Инвестиции
https://support.mts.ru/invetitsii/brokerskii-schyot/otkritie-brokerskogo-schyota;Открытие брокерского счёта;Как открыть брокерский счёт в приложении МТС Инвестиции , которое можно скачать в AppStore , Google Play или AppGallery . На вкладке Мои активы выберите Брокерский счёт и нажмите Открыть счёт . Введите личные данные по паспорту РФ и подпишите документы с помощью СМС-кода. После этого заявка на открытие счёта отправится в банк в приложении МТС Банк. Для этого выберите на главном экране пункт Инвестиции , нажмите Открыть счёт и следуйте подсказкам в приложении на сайте МТС Инвестиции . На главной странице нажмите на баннер Открыть брокерский счёт и зарегистрируйтесь со своим номером телефона. Пользоваться брокерским счётом на сайте невозможно. Нужно скачать приложение МТС Инвестиции Можно ли открыть брокерский счёт в приложении, если я не гражданин РФ Нет. Открыть брокерский счёт в приложении может только гражданин РФ старше 18 лет со статусом налогового резидента РФ. Можно ли открыть брокерский счёт ИИС Нет, пока в МТС Банке не реализована такая возможность. Как быстро открывается брокерский счёт Обычно в течение часа. В редких случаях процедура может занять до двух рабочих дней. Не получается открыть брокерский счёт из-за ошибки в данных, но ошибки нет Скорее всего, в государственной базе данных СМЭВ указаны некорректные данные о вашем ИНН. Это можно проверить на сайте Налоговой службы. Там же можно дистанционно подать заявление на уточнение данных. После того, как налоговая обновит ваши данные, вы сможете открыть брокерский счёт.;МТС Инвестиции
https://support.mts.ru/invetitsii/brokerskii-schyot/popolnenie-brokerskogo-schyota;Пополнение брокерского счёта;Как пополнить брокерский счёт В приложении МТС Банк в разделе Инвестиции — Мои активы — Пополнить со счета или дебетовой карты МТС Банка В приложении МТС Инвестиции в разделе Мои активы — Брокерский счёт — Пополнить . При пополнении с банковской карты стороннего банка в приложении МТС Инвестиции удерживается комиссия в размере 0,65% от суммы пополнения. По реквизитам из любого банка. Реквизиты для пополнения можно посмотреть в приложении МТС Инвестиции — Мои активы — Реквизиты . Во избежание ошибок при заполнении платёжного поручения копируйте реквизиты из приложения. Пополнять брокерский счёт по реквизитам можно только с банковского счёта клиента. Пополнение со счетов третьих лиц невозможно. С кредитной карты брокерский счёт лучше не пополнять – ваш банк может удержать комиссию как за снятие наличных. Как быстро пополняется брокерский счёт Если пополняете через вкладку Мои активы в приложении МТС Инвестиции с карты — зачисление происходит в течение нескольких минут. При пополнении по реквизитам зачисление обычно происходит не позднее следующего рабочего дня. Если на следующий рабочий день после отправки денег вы всё ещё не видите их на счёте, напишите нам через форму обратной связи в приложении МТС Инвестиции. Обязательно укажите ваши ФИО и детали платежа. Я пополнил счёт, в операциях пополнение есть, но баланс не увеличился Баланс счёта обновляется в рабочие дни в 10:00 МСК  —  одновременно с открытием торгов. Если биржа открылась, а ваш баланс так и не обновился, напишите нам через форму обратной связи в приложении МТС Инвестиции.;МТС Инвестиции
https://support.mts.ru/invetitsii/brokerskii-schyot/vivod-deneg-zakritie-brokerskogo-scheta;Вывод денег, закрытие брокерского счета;Как вывести деньги с брокерского счёта 1. Зайдите в приложение МТС Инвестиции — раздел Мои активы — Меню в верхнем углу — Вывести средства 2. Введите реквизиты вашего банковского счёта Комиссии за вывод нет. Вывести деньги на электронные кошельки, виртуальные карты, чужой банковский счёт не получится Реквизиты банковского счёта можно найти в приложении вашего банка, в разделе Реквизиты . Номер счёта состоит из 20 цифр и начинается с 40817 Когда после продажи бумаг можно подавать поручение на вывод средств На следующий торговый день, т.к. по правилам биржи ценные бумаги торгуются в режиме Т+1. Режим Т+1 означает, что фактические расчёты по сделке, заключённой сегодня, пройдут на следующий торговый день. Поручение на вывод денег можно подавать только после того, как они фактически поступили на ваш брокерский счёт — после окончания расчётов по сделке. Сколько времени занимает вывод денег Как правило, мы выводим деньги не позднее следующего рабочего дня после подачи поручения. Поручение в обработке отображается с иконкой часов в приложении МТС Инвестиции на вкладке Операции — Брокерский счёт. Деньги обычно приходят в течение нескольких часов после того, как эта иконка пропадает. Если через один рабочий день после подачи поручения на вывод, деньги всё ещё не пришли — напишите нам через форму обратной связи в приложении МТС Инвестиции — раздел Еще — Помощь — Обратная связь. Почему при попытке вывести деньги появляется сообщение об ошибке Вы пытаетесь вывести деньги на электронный кошелёк или другой виртуальный счёт В настройках телефона не выставлена синхронизация времени и часового пояса с сервером Если вы уверены, что проблема не в этом, напишите нам через форму обратной связи в приложении МТС Инвестиции — раздел Еще — Помощь — Обратная связь. . Я подавал поручение на вывод одной суммы, а поступило меньше Мы удержали с вас НДФЛ по доходам, полученным от операций с ценными бумагами. Вы получите об этом отчёт на адрес электронной почты, указанный в вашей анкете. Почему для вывода мне доступно меньше денег, чем я вижу в свободном остатке Потому, что ценные бумаги торгуются в режиме Т+1. Если вы продали бумаги, то сразу увидите деньги от их продажи у себя в свободном остатке, но на самом деле они поступят на счёт только на следующий торговый день. Для вывода нужно дождаться их поступления на счёт. Доступный для вывода объём приложение показывает при вводе заявки на вывод. Там же вы можете посмотреть, когда на счёт поступит сумма от ваших недавних продаж. Как закрыть брокерский счёт Сообщите нам о намерении закрыть счет письмом на адрес mtsi@mtsbank.ru или через форму обратной связи в приложении МТС Инвестиции Дождитесь, когда мы подготовим необходимые документы Посетите ближайший офис МТС Банка, чтобы подписать документы, или передайте подписанные документы через чат приложения МТС Банк Комиссий за ведение счёта нет — вы платите только тогда, когда совершаете сделки. Можете оставить счёт открытым — возможно, он пригодится вам в будущем.;МТС Инвестиции
